{
  "$schema": "https://json-schema.org/draft/2020-12/schema",
  "$id": "https://contrabass.dev/schemas/worker-protocol/v1/events.json",
  "title": "WorkerEventLine",
  "description": "Schema for ONE NDJSON line of POST /v1/runs/{runId}/events (Content-Type: application/x-ndjson). The endpoint accepts up to 200 lines or 512 KiB total per request. See worker-protocol spec: 'Event stream upload via NDJSON'.",
  "type": "object",
  "additionalProperties": false,
  "required": ["ts", "kind", "payload", "protocol_version"],
  "properties": {
    "ts":   { "$ref": "_common.json#/$defs/EpochMillis" },
    "kind": {
      "type": "string",
      "enum": ["start", "log", "tool_call", "diff", "error", "phase"],
      "description": "Event category. Frozen — additions require v2."
    },
    "payload": {
      "description": "Kind-specific payload. Schema is open here; per-kind shapes are documented in cloud/src/workerproto/v1/event-payloads.ts.",
      "type": ["object", "array", "string", "number", "boolean", "null"]
    },
    "seq": {
      "type": "integer",
      "minimum": 0,
      "description": "Monotonic per-run sequence number assigned by the worker. Optional but recommended for replay deduplication."
    },
    "protocol_version": { "$ref": "_common.json#/$defs/ProtocolVersion" }
  },
  "$defs": {
    "ErrorCode": {
      "type": "string",
      "enum": [
        "events_too_large",
        "events_too_many",
        "lease_revoked",
        "run_terminal",
        "run_unknown",
        "invalid_ndjson"
      ]
    },
    "Limits": {
      "description": "Server-enforced limits (informational; not part of wire payload).",
      "type": "object",
      "properties": {
        "maxEventsPerRequest": { "const": 200 },
        "maxBytesPerRequest":  { "const": 524288 }
      }
    }
  }
}
