[
  {
    "protocol_version": "1.0.0",
    "ts": 1767225601000,
    "seq": 1,
    "kind": "start",
    "payload": {
      "agentRunner": "codex",
      "worktreePath": "/tmp/contrabass/workspaces/LIN-123",
      "branch": "feature/lin-123"
    }
  },
  {
    "protocol_version": "1.0.0",
    "ts": 1767225606000,
    "seq": 6,
    "kind": "phase",
    "payload": {
      "phase": "verify",
      "label": "running contract tests"
    }
  }
]
